<?xml version="1.0" encoding="UTF-8"?>
<!ELEMENT faqs (faq+)>
<!ELEMENT faq (domanda, risposta, data_creazione, fonte)>
<!ELEMENT domanda (#PCDATA)>
<!ELEMENT risposta (#PCDATA)>
<!ELEMENT data_creazione (#PCDATA)>
<!ELEMENT fonte (#PCDATA)>
<!ATTLIST faq id CDATA #REQUIRED>